,ID,Corpus,clean_text,Topic,Probability
0,769460,No work. Staying with my family. .  More time to spend with my family.,work stay family time spend family,1,1
1,00babb90,no communte,communte,6,0.587137303
2,00db60f1,Working from home. Working from home. Home improvements done and less commuting. Home working,work home work home home improvement do less commuting home work,11,0.758484767
3,01297d76,"More time with family, learning French, appreciating b  ET img able to go on walks once my self isolation was over.  Less social pressure. Less traffic on the roads. More time with family.. I don't have to rush about as much as I am working from home. I am less tired. The air is cleaner and there is less traffic. I have saved money as the things I normally do have been closed.",time family learn french appreciate b et img able go walk self isolation less social pressure less traffic road time family .. do not rush much work home less tired air cleaner less traffic save money thing normally do close,-1,0
4,01559bfb,"More exercise.   I have worked from home the entire time, which saved two hours of commute every day and also allowed me to structure my day differently. I've been able to exercise more often, lost weight, and was just as effective at work.",exercise work home entire time which save two hour commute every day also allow structure day differently able exercise often lose weight effective work,0,0.912723479
5,1.81E+77,Had time to think about my direction in life.,time think direction life,-1,0
6,0180ea1d,more meditation and informal learning. due to disability I cant get out everyday but have something to do on zoom every day. time to explore spirituality. been able to save money,meditation informal learning due disability ca nt get everyday something do zoom every day time explore spirituality able save money,-1,0
7,01c706a7,I spend a lot of time with my parents.  I spend more time with my parents,spend lot time parent spend time parent,4,0.892950805
8,0206c601,"More time with children, less time working.   Increased savings",time child less time work increase saving,4,0.894845835
9,027eaa15,I've become more aware of the importance of reaching out to people. I've grown closer to people I drifted away from over the years.,become aware importance reach people grow close people drift away year,9,0.821009248
10,029e60cf,"More opportunities to try for a baby, being closer with family, movie nights. More sex, finish diy.  More time with the family, time for DIY and gardening",opportunity try baby close family movie nights sex finish diy time family time diy gardening,-1,0
11,02ce3583,"more relaxation, more walking, more reading. more time to relax and indulge in reading, TV, gardening etc.  MORE RELAXATION TIME, MORE WALKING IN THE OPEN AIR",relaxation walk read time relax indulge read tv garden etc relaxation time walk open air,-1,0
12,02f2e2f3,"work from home. work from home, boomer doomer. working from home. work from home",work home work home boomer doomer work home work home,7,0.837847804
13,0307f96f,Being stronger as a family. More exercise.,strong family exercise,0,1
14,033ab2b0,More connecting with family and friends via phone calls. calling family and friends more.,connect family friend via phone call call family friend,6,1
15,03a9cf9a,spending more time with family at home. Community pulling together.,spend time family home community pull together,9,0.776433279
16,03b74c83,"stimulus payments, quitting drinking and exercise daily now",stimulus payment quit drinking exercise daily,10,1
17,03c42dd6,More time tl spend with family. Exercising more and eating more healthily. Sleeping better at night. I returned to study part time and also spend more time outdoors with my husband. My husband has lost weight too. More time with family. Cleared some debt and done work around the home.,time tl spend family exercise eat healthily sleep well night return study part time also spend time outdoors husband husband lose weight time family clear debt do work around home,0,0.938593929
18,03d6be1a,"Catching up on a backlog of tasks at home.  More walks, and catching up on backlogs of chores and paperwork.. More and regular country walks, less distraction from things I want to do at home, decluttering, catching up on paperwork backlog, consciously improving relationshipsn",catch backlog task home walks catch backlogs chore paperwork .. regular country walk less distraction thing do home decluttere catch paperwork backlog consciously improve relationshipsn,8,0.763056085
19,0483c23c,"Increased time with family, reevaluate priorities. More time with immediate family and working out at home. More time together as a family. more time at home with family",increase time family reevaluate priority time immediate family work home time together family time home family,-1,0
20,052e6709,No commuting.,commute,11,0.912524372
21,0576642f,Working from home has greatly lowered work related stress. Working from home means i am less burnt out from work. I rest more and i exercise more. More rest during lockdown. More rest - working from home,work home greatly lower work related stress work home mean less burn work rest exercise rest lockdown rest work home,5,1
22,05ac6d57,More time with children. More time with my children. More time with my children . More time with my children,time child time child time child time child,2,0.811500652
23,05b27157,"I am spending more time with my partner and talking to friends and family over phone call.. spending more time with immediate family, eating homemade healthy food, sleeping well and many more. got to spend quality time at home. I feel more productive working from home",spend time partner talk friend family phone call .. spend time immediate family eat homemade healthy food sleep well many got spend quality time home feel productive working home,-1,0
24,05b7650a,"Spending more time with family, less time driving and more time exercising. Eating more healthily, less food waste, more exercise . Quality time with children and more time at my allotment. Focusing on the important aspects of life; increased time with children; more leisure time",spend time family less time drive time exercise eat healthily less food waste exercise quality time child time allotment focus important aspect life increase time child leisure time,0,0.967618976
25,05d4d6c0,getting out to exercise with the children.,get exercise child,12,0.459809291
26,06b51bd6,"I am enjoying not being at work (I am fortunatly being paid still). I am enjoying working from home and having more time for things i want to do. Nice to have time off work during the first lockdown. I liked the peacefulness of it.. I have enjoyed not being in work so much, and having much less work. I have enjoyed the city being emptier and less cars.",enjoy not work fortunatly pay still enjoy work home time thing do nice time work first lockdown like peacefulness .. enjoy not work much much less work enjoy city empty less car,-1,0
27,06b5f325,Enrolled into masters,enrol master,-1,0
28,06c3c1ed,helping others. community spirit and helping people I previously didn't know. opportunity to help in the community.,help other community spirit help people previously not know opportunity help community,9,1
29,06d753d5,"more time spent with family, no aircraft pollution. personal relationships, more organised.",time spend family aircraft pollution personal relationship organise,1,0.944274103
30,7842027,less pollution and traffic.,less pollution traffic,3,1
31,07c18654,"Walking every day .cooking and eating I healthier. Self isolation, shopping once every 14 days exercising 1hr per day.  More exercise",walk every day .cooke eat healthy self isolation shop every 14 day exercise 1hr per day exercise,0,0.992097778
32,07dac8b9,Reduced shopping opportunities so more making from what we have. Financial no holidays. Financial-no vacations,reduce shopping opportunity make what financial holiday financial vacation,10,1
33,0868179b,Getting closer to my husband.,get close husband,1,0.624779134
34,093482f6,"Spending more time with family, saving money, feel less stressed. More walking and seeing friends. working from home, saving money, spending more time with my family",spend time family save money feel less stressed walk see friend work home save money spend time family,5,1
35,093a7c48,"More family time,getting more work done. More time with family . Opened my eyes to this huge scam. Meet new like minded people",family time get work do time family open eye huge scam meet new like minded people,-1,0
36,0974c46d,I can get food and necessities delivered to my home as long as I can pay for it and don't have to go out.,can get food necessity deliver home long can pay do not go,-1,0
37,09bb381d,More time for me.. Self-knowledge related. Selflearning and resilience,time .. self knowledge relate selflearne resilience,-1,0
38,09c5edc3,Doing more exercise. Learnt a new language.  New girlfriend,exercise learn new language new girlfriend,8,1
39,0a0f9b59,"Working from Home has reduced travel time and it's less stressful, and I can concentrate more. Working from Home, avoiding long hours in transportation. More time with my husband. Working from home is something that should be the norm. Working from home is better for my mental health. And less expensive",work home reduce travel time less stressful can concentrate work home avoid long hour transportation time husband work home something norm work home well mental health less expensive,5,1
40,0a4d3770,New friendships. More time with the children,new friendship time child,2,0.680833891
41,0a51425b,"Dinner at home. having my family together, and not travelling for work. Having my daughter home from college and making more meals together with my family",dinner home family together not travel work daughter home college make meal together family,1,0.510440832
42,0a82a29f,"Saving money, earning extra money with extra available time, working out and losing weight. Saving money, earning more money, working out more. More workouts, weight loss. weight loss, more workouts, healthy eating, saved a lot of money",save money earn extra money extra available time work lose weight save money earn money work workout weight loss weight loss workout healthy eat save lot money,0,0.910342976
43,0b437e1f,Got a pet. Literary programs are available online now. Moved to a better living situation.,get pet literary program available move well living situation,-1,0
44,0b6ab69c,"running more and reading a lot. More active, working on myself, more healthy. Made me open my eyes. New job where im really happy at",run read lot active work healthy make open eye new job where m really happy,0,0.980461376
45,0b70263c,"I was already socially isolated due to chronic illness, now that is the norm so I was already adapted and am not missing out on so many social events. Increased acceptance of socializing via video,  increased opportunity to work from home, healthier meals, more home cooking, slower paced life, delivery/takeout more available from most everywhere (these were all difficulties for me pre-pandemic due to disability)",already socially isolate due chronic illness norm already adapt not miss many social event increase acceptance socializing via video increase opportunity work home healthy meal home cook slow paced life delivery takeout available everywhere difficulty pre pandemic due disability,-1,0
46,0bc954cd,Working from home and confined at home. Spending less money. Saving money as no longer commuting.,work home confine home spending less money save money long commute,11,0.887410929
47,0cccf65d,Quite and less pollution. More time to complete DIY tasks.. Able to tackle some DIY at home.,quite less pollution time complete diy task .. able tackle diy home,-1,0
48,0cd23e27,less waste!.,less waste,-1,0
49,0cec7738,Doing more yoga practice at home.,yoga practice home,0,1
50,0cf6d4d9,I'm eating healthier and exercising more. I'm working out a lot more improving my fitness..,eat healthy exercise work lot improve fitness ..,0,1
51,0d4a1693,Havibg time to catch up on reading. More time to think and reclect.,havibg time catch reading time think reclect,8,0.632471814
52,0d635a37,"more conscience of being more sanitary.  Being more resourceful in finding alternative solutions to shopping, exercise",conscience sanitary resourceful find alternative solution shopping exercise,3,0.675293548
53,0df8a425,More time with family.,time family,2,0.844498478
54,0e66785e,"financial uncertainty. Gratitude for life. Time to stocktake and reprioritise. Improved relationships, better life balance",financial uncertainty gratitude life time stocktake reprioritise improve relationship well life balance,9,1
55,0e8ee643,"Sanitizing more, meditating often and eating better.. More meditation and exercise. Health, diet, working out. Better workout routine, diet, closer bonds to family members",sanitize meditate often eat well .. meditation exercise health diet work well workout routine diet close bond family member,-1,0
56,0ee3cf79,got out of debt.,get debt,-1,0
57,0f0b6317,more hygenic.,hygenic,-1,0
58,0f111ef3,Better work interactions.,well work interaction,-1,0
59,0f1a455c,"Connecting virtually with loved ones, more time at home to enjoy garden. More time with family and to exercise. Less commute, better work-life balance, more exercise. Less time spent commuting, more time exercising.",connect virtually love one time home enjoy garden time family exercise less commute well work life balance exercise less time spend commute time exercise,0,1
60,0f34108d,Relationship,relationship,1,1
61,0fd5b77a,More time with family. Spending more time with the whole family.  I have been luckily able to spend more time with the family.,time family spend time whole family luckily able spend time family,1,1
62,0fefd757,Greater telephone contact with family and friends.,great telephone contact family friend,6,0.856605217
63,1075c575,Increased income.,increase income,-1,0
64,1119cb1a,motivated to learn new things and cope without company.   dont spend so much money.,motivate learn new thing cope without company do nt spend much money,0,0.845517814
65,112d9cb0,more family time.,family time,2,1
66,11361af8,"With my child at home, I've found myself being more active. Spending more time with my child. I have been focusing on a healthier diet because of the extra time at home. It has motivated me to reevalute my physical and mental health and I have taken direct steps to improve both.",child home find active spending time child focus healthy diet extra time home motivate reevalute physical mental health take direct step improve,-1,0
67,114578a1,Exercise and weight loss. More exercise and healthier diet. Weight loss. Weight loss,exercise weight loss exercise healthy diet weight loss weight loss,-1,0
68,1175894c,More walking. Eating more vegetables.,walk eat vegetable,-1,0
69,121ecde4,"Spending more time together as a family doing fun thing like baking,playing games and doing some home schooling . Being at home homeschooling.  Out more walking",spend time together family fun thing like bake playing game home schooling home homeschooling walk,4,0.693898345
70,12230669,More family time.  spend more family time together now,family time spend family time together,1,0.855498411
71,123ca171,Now i dont need to go shopping like i always did before.,do nt need go shop like always,3,0.660729979
72,12ae38b3,Growing vegetables. An interest in gardening and growing my own food. Growing my own vegetables.,grow vegetable interest gardening grow food grow vegetable,-1,0
73,12f1d120,"Better communication and sense of support between myself, my mother, and my sister",well communication sense support mother sister,6,0.411960704
74,1350da71,more time at home.  More sleep. More me time,time home sleep time,2,0.733450935
75,13a0d4d9,"Walking more. LESS TRAFFIC, MORE ORGANISED SHOPPING.",walk less traffic organise shopping,3,0.686359425
76,148f41f5,"Neighbours are talking a lot more and checking if we all have everything we need (while maintaining distance). Less traffic, air feels cleaner.. I'm doing a lot more yoga. Closer to family",neighbour talk lot check everything need maintain distance less traffic air feel clean .. lot yoga close family,3,0.624628239
77,151dc4f1,full time employment. Full time employment for more than an year.,full time employment full time employment year,-1,0
78,153c0a3c,"More time to work at home because I'm not going anywhere at all. Able to train (running) more due to not commuting. Incredibly, during the shutdown I had time to resume running, and am back up to 30 miles per week.  Also, people are now focused on their health, so I'm selling large amounts of vitamins.. in 2020, due to distance learning, I had more time, and was able to get back to running 33 miles/week",time work home not go anywhere able train run due not commute incredibly shutdown time resume run back 30 mile per week also people focus their health sell large amount vitamin .. 2020 due distance learn time able get back run 33 mile week,0,0.971805926
79,1557d8f9,Fitness. Fitness,fitness fitness,12,1
80,15dd865d,Have loved in with parents. More time to spend with familiy. More time spent with family,loved parent time spend familiy time spend family,1,0.885856349
81,16942fae,"Empty roads, peace and quiet, no aeroplanes . Peace and quiet, less road traffic, families doing things together..",empty road peace quiet aeroplane peace quiet less road traffic familie thing together ..,3,1
82,16999d45,Cutting down on expenses . I spend less money now. I spend less money eating out.,cut expense spend less money spend less money eat,10,1
83,16e1b932,"Less pollution, seeing more wildlife. enjoying time at home. Been able to slow down and appreciate things I took for granted",less pollution see wildlife enjoy time home able slow appreciate thing took grant,3,0.774356167
84,16f0fd3d,More hand washing and awarenss of virus spread and how to avoid it.,hand washing awarens virus spread how avoid,13,1
85,170e73ea,"thinking, quiet, reading , meditation.",think quiet read meditation,-1,0
86,176486a2,"much slower pace of life. calmer. Less tired. Acceptance of doing less, and being introverted",much slow pace life calm less tired acceptance less introverted,-1,0
87,176c5c5b,"My husband has been gone during my maternity leave, so we have equal time with the baby. Saved some money, husband was home as well during maternity leave",husband go maternity leave equal time baby save money husband home well maternity leave,-1,0
88,176e04e7,I wouldn't have started at the career I'm at now (pharmacy technician) if not for COVID,would not start career pharmacy technician not covid,-1,0
89,1807dbc5,"There is more sense of community with people trying to help each other.. There seems to be a greater sense of community and a 'we're all in this together spirit'. Spent more time with my family, enjoyed more hobbies, I have spent less money. Financially better off",sense community people try help .. seem great sense community together spirit spend time family enjoy hobby spend less money financially well,9,1
90,195d6fcb,More frequent communication with my mother. Upcoming Stimulus payment. increasded communication with family members. Temporary housing became more available.. Improved income due to pandemic unemployment assistance and stimuluses. Possibilities for improved housing assistance.,frequent communication mother upcoming stimulus payment increasde communication family member temporary housing become available .. improved income due pandemic unemployment assistance stimulus possibility improve housing assistance,10,0.523666002
91,196d1e37,"Time for self-reflection and re-connectedness with the nature. reconnectedness with the nature, appreciation of life, more time for self-reflection, and avoiding overcrowded buses or trains when I had to commute to work. Appreciation of, and connectedness to nature. Appreciation of nature",time self reflection re connectedness nature reconnectedness nature appreciation life time self reflection avoid overcrowded bus train when commute work appreciation connectedness nature appreciation nature,-1,0
92,19c40738,"Exercising more, performing more personal tasks. More time to study course materials to learn something new.",exercise perform personal task time study course material learn something new,8,0.695442943
93,1a0b9af7,I am able to work from home which I find better than working from the office,able work home which find well working office,7,0.367131573
94,1a0d014a,"Started diet.  spending less, doing more activities like crafts, reading more. Cooking at home, cleaning, washing hands more, saving more",start diet spending less activity like craft read cook home clean wash hand save,0,1
95,1a541e3b,Working out at home and catching up with friends through video chat. More home workouts. family time. working from home,work home catch friend video chat home workout family time work home,7,0.484084616
96,1a725420,More time with my husband and time to spend with God. Spending more time with my husband. More time to think and process.. Deeper relationships,time husband time spend god spend time husband time think process .. deep relationship,1,1
97,1a7e3ece,MORE EXERCISE.,exercise,12,1
98,1ba01db0,"Taking things slower, time to pursue hobbies. slowed down.  Slowed down",take thing slow time pursue hobby slow slow,8,0.763056085
99,1bcac18d,"Time at home to catch up, speaking to friends I havent spoken to for a long time.  My partner lives in Manchester but was here when lockdown started so is still here. Getting lots done at home, my partner who lives in Manchester being here with me.",time home catch speak friend nt speak long time partner live manchester when lockdown started still get lot do home partner who live manchester,-1,0
100,1bd369ff,I get to spend more time with my family.  Spend time with family. more time with family,get spend time family spend time family time family,1,1
101,1cae16ed,Community spirit. Community spirit and better relationships with neighbours. Got fitter by working at at home and cooking more meals. Community spirit and relationship with my son,community spirit community spirit well relationship neighbour get fitter by work home cooking meal community spirit relationship son,9,1
102,1d3f0c91,"Reading more, learning Spanish, playing guitar. Being able to save money.",read learn spanish play guitar able save money,8,0.943377222
103,1d5f2287,More exercise etc.,exercise etc,12,1
104,1da9ec41,"More conscious of health and looking after myself with healthier diet and exercise. More community spirit with neighbours & walking more for my daily exercise. Increased exercise. More time with my husband, increased exercise, more community spirit on our street",conscious health look healthy diet exercise community spirit neighbour walk daily exercise increase exercise time husband increase exercise community spirit our street,0,0.903939659
105,1dc217e8,spending more time with family at home. spending more time with family at home. Not having to travel to work. Work life balance is better now that I work from home more. Less tarvelling time and at home when my daughter comes home from high school. We spend a lot more time as a family together too. I am able to work form home now providing a better work life balance,spend time family home spending time family home not travel work work life balance well work home less tarvelling time home when daughter come home high school spend lot time family together able work form home provide well work life balance,5,1
106,1deee505,"More exercise. More exercise, more community awareness. More exercise. I have exercised more",exercise exercise community awareness exercise exercise,12,1
107,1e321ed5,Time with family. More family time. more time with family.,time family family time time family,2,0.867798829
108,1e3689e3,Starting later in my job. Less pollution.  Quieter roads,start later job less pollution quiet road,3,1
109,1ef0a072,Less traffic . Less traffic!. Community spirit. Different view of life. Closer community.,less traffic less traffic community spirit different view life close community,3,0.85617585
110,1f12b27e,"Husband working from home, cooking more.",husband work home cook,7,0.367228063
111,1f4edae5,"Time to relax at home is a rare thing. More time at home. Working from home is better for my mental health and given me more time to focus on hobbies exercising and being healthier overall. Working from home so improved work life balance, happier, less anxious, less crowded trains",time relax home rare thing time home work home well mental health give time focus hobby exercise healthy overall work home improve work life balance happy less anxious less crowded train,5,1
112,1f923242,"Working from home. Working from home, more rested. Better work life balance due to less commuting. Shorter commute time",work home work home rest well work life balance due less commuting short commute time,11,1
113,1f9f5f13,Family time. spending time with family. Working from home. Quality time with child,family time spending time family work home quality time child,4,0.753228961
114,1ffc3964,More physical excercise. Taking more physical excersise and talking more and spending more time with my spouse.. Spent quality time with my wife while on furlough which seemed to bring us closer psychologically.,physical excercise take physical excersise talk spending time spouse .. spend quality time wife furlough which seemed bring we close psychologically,0,1
115,2048f258,Need to be careful not to be near anyone. Only shop 1 time a week. cannot go out.. Have to take extra care working and must be shielded at all times. a  different way of working and shopping,need careful not near anyone shop 1 time week can not go .. take extra care working must shield time different way work shopping,-1,0
