,ID,Corpus,clean_text,Topic,Probability
547,a333828c,Wfh and no long commute has given me a lot more free time. WFH means more free time. less commuting time. dont need to commute,wfh long commute give lot free time wfh mean free time less commuting time do nt need commute,11,0.868130759
548,a443da96,More exercise.. More exercise.,exercise .. exercise,12,1
549,a448583a,"Closer relationship to friends and family. Closer relationship to family members due to quarantine, closer relationship to friends due to increased communication through social media.. Focused on mental and physical wellness, started a podcast, improved skincare, and lost weight. Improved relationships, improved grades, improved focus on self-care, and improved focus on goals.",close relationship friend family close relationship family member due quarantine close relationship friend due increase communication social medium .. focus mental physical wellness start podcast improve skincare lose weight improve relationship improve grade improve focus self care improve focus goal,-1,0
550,a46a3524,chance to slow life down and spend time with daughter. speaking to family members more often. Closer to daughter. time to take up hobbies.. more time with daughter. More time with family and dogs,chance slow life spend time daughter speak family member often close daughter time take hobby .. time daughter time family dog,4,0.818269089
551,a474e45b,Communicated with family more.,communicate family,6,0.505856339
552,a4810fac,"finding presence, purpose, gratitude, stoking creativity, more time with my son, lots of good home cooked meals, more awareness, more knowledge, more growth, more freedom and peace from deep within myself. perspective. insight. Inner awareness and strength",find presence purpose gratitude stoke creativity time son lot good home cooked meal awareness knowledge growth freedom peace deep within perspective insight inner awareness strength,9,1
553,a5575d9a,I exercise more. I work out a lot more and cook much more.,exercise work lot cook much,1,1
554,a58b5e9e,school cancelled.,school cancel,-1,0
555,a61db8ec,More time to reflect and relax.,time reflect relax,-1,0
556,a65bad7a,I spent more time with my son,spend time son,4,1
557,a69ec03a,Enjoying time at home and doing other things that I normally wouldn't have time to do. Getting a lot accomplished during quarantine. More time with close friends.,enjoy time home thing normally would not time do get lot accomplish quarantine time close friend,-1,0
558,a6e3ea1b,"Greater appreciation of nature and the natural world. Working less days, more time off. Working conditions changes",great appreciation nature natural world work less day time working condition change,5,0.939616548
559,a7518dbb,"more time to study and reposition for the future. Taking care of things around the house and exercising more.. Lost weight, Gained muscle, Grew closer to wife.",time study reposition future take care thing around house exercise .. lose weight gain muscle grow close wife,0,1
560,a78edc1b,People speaking that wouldn't normally and neighbours offering to shop for vulnerable. enjoying the garden more. WALKING MORE. more time with my husband,people speak would not normally neighbour offer shop vulnerable enjoy garden walk time husband,-1,0
561,a7eede77,spend less on petrol,spend less petrol,10,0.886322488
562,a80e3f31,"Ability to use facilities when available as a form of exercise.. Reduced traffic to a minimum, increased time with family. More time spent at home with family etc. Relaxing",ability use facility when available form exercise .. reduce traffic minimum increase time family time spend home family etc relax,-1,0
563,a83989aa,"I am baking more. I also started participating in live virtual events, conferences, training, tours, etc.  It's opened up some new experiences for me.. I've taking advantage of online classes, educational life stream events, and other interesting online events pertaining to heritage, nature, music, history, etc.  I would have never participated in these had they not all moved to the web.",baking also start participate live virtual event conference train tour etc open new experience .. take advantage class educational life stream event interesting event pertain heritage nature music history etc would never participate not move web,0,0.738734243
564,a857ec3b,"I have been exercising more. Eating together as a family, bike rides and walks.  I had time to do some sorting, get fitter",exercise eat together family bike ride walk time do sort get fitter,0,0.948508837
565,a8c5c3d3,Less driving.  Working from home more often,less drive work home often,11,1
566,a913557e,work from home.,work home,7,1
567,a979e3b5,Talking more to my family.  spending more time with my husband,talk family spending time husband,1,0.817260168
568,a99e54c8,Learning skills.,learn skill,8,1
569,aa3ffcea,"More time with loved ones, trying to look after health better, getting more reading in. Reading more, taking better care of my health. Opportunity to keep priorities in order, more time at home with loved ones, the little things seem bigger now (in a good way). More time with loved ones, pursuing hobbies such as journaling",time love one try look health well get reading read take well care health opportunity keep priority order time home love one little thing seem big good way time love one pursue hobby journale,8,0.575144885
570,aa64cc80,"more reading and picking up musical instruments I haven't touched in years. exercising more. My street is much quieter now , so I have been able to sleep better and that has helped me to feel better in general.",read pick musical instrument not touch year exercise street much quiet able sleep well help feel well general,-1,0
571,aa78ea32,Prefer online examinations,prefer examination,-1,0
572,aa7da913,"Reduction in alcohol intake. No alcohol, more exercise. lower alcohol use. Zero alcohol intake for long periods.",reduction alcohol intake alcohol exercise low alcohol use zero alcohol intake long period,-1,0
573,aa9abc88,More time with children.   I've spent more time with my children because going to work isn't an option currently,time child spend time child go work not option currently,4,0.894845835
574,ab3f3be8,"Exercise, running, weight loss.",exercise run weight loss,-1,0
575,ab4a29d7,More time at home  together with husband and baby. More time with my daughter and husband.,time home together husband baby time daughter husband,4,0.63186892
576,abc752c6,"More exercise, spending time with family. Made me realise a few things I need to change in my life. Became debt free",exercise spend time family make realise thing need change life become debt free,0,0.952093886
577,ac03a50f,Being able to spend more time with my children. Spending more time with my husband and children.  Spent more time with my children.,able spend time child spend time husband child spend time child,4,1
578,ac58708f,I started a creative project (blog).,start creative project blog,-1,0
579,ac61d972,"A lot of things such as shopping and ordering food online, a lot of things are a lot more slower to get in contact with such as banks, shopping retailers, etc..",lot thing shop order food lot thing lot slow get contact bank shop retailer etc ..,-1,0
580,ac89e935,"I'm eating at home solely. I am able to still work, and the stimulus check.. More time with family. With the stimulus, I was able to pay a few bills",eat home solely able still work stimulus check .. time family stimulus able pay bill,10,1
581,ac9269d2,"More time for hobbies, cooking, exercise.  No commute so more time to get out in nature, although this is harder in the week now it's dark after work. Working from home",time hobbie cook exercise commute time get nature although hard week dark work work home,-1,0
582,acbbe2b3,"Took time off.  Stimulus check. stimulus money, more time",take time stimulus check stimulus money time,10,1
583,acbcb617,"Accompanied each other more. Spend more time with family . More time spent with family, some money saved. more time spent with self,family and significant other",accompany spend time family time spend family money save time spend self family significant,1,0.743405386
584,acf0665b,"I was able to move back home from a school that I didn't thrive at. In addition, I was closer to my significant other.",able move back home school not thrive addition close significant,-1,0
585,ad3ab7a4,"Learnt how to use video calls to stay in touch. Saving more money, walking more instead of taking buses. Better finances, simpler life, fewer worries",learn how use video call stay touch save money walk instead take bus well finance simple life few worry,6,0.392355069
586,ae2f8f84,"been able to work from home, and to study from home, spend more time with family, exercise more, etc",able work home study home spend time family exercise etc,-1,0
587,ae3b5411,More Family time. Family time,family time family time,2,1
588,aef3027c,isolating 12 weeks. isolating. saved money. more outdoor exercise,isolate 12 week isolate save money outdoor exercise,0,0.868548138
589,af1fb2be,Finding work and having time out of education,find work time education,-1,0
590,af2515aa,Appreciate the little things more,appreciate little thing,9,0.969529015
591,afcfa56f,"received stimulus check. stimulus check and cooking more at home. The stimulus checks helped, and both my partner and I appreciate that we were both able to keep working when others could not.",receive stimulus check stimulus check cook home stimulus check help partner appreciate able keep work when other could not,10,1
592,afde9adb,Quarantine. Furloughed from work. Self isolation in my flat which has meant loss of social life and activities..,quarantine furlough work self isolation flat which mean loss social life activity ..,-1,0
593,afe189a8,"Improved finances, less pressure, don't have to see people I don't like, spend more time with immediate family, less traffic on journey to work. Reduced traffic on my commute, means I can avoid seeing people I don't like, spend more time with my children.  Working from home, not having such a presured life, being stuck in traffic rushing from home to work, or taking my children to after school activities.",improve finance less pressure do not see people do not like spend time immediate family less traffic journey work reduce traffic commute mean can avoid see people do not like spend time child work home not presured life stick traffic rush home work take child school activity,-1,0
594,b00fd097,"Hygiene, LOTS of walking, biking!. Washing hands, and taking exercise more seriously!. More studying, more together time with family, etc. cooked more, sorted the house out, did my garden, started to jog, etc",hygiene lot walk bike washing hand take exercise seriously study together time family etc cook sort house garden start jog etc,0,1
595,b013304e,"I'm glad to have moved back in with my mom; it was rough trying to afford living in the big city with my boyfriend. This past year+ has definitely been the worst of my life by a huge margin, but not all of that was due to COVID. Likewise, my mom became unemployed at the start of the pandemic, but her company was being sold anyway, and extensions of unemployment due to COVID have helped as at 60, she's yet to find another job.",glad move back mom rough try afford live big city boyfriend past year+ definitely bad life by huge margin not due covid likewise mom become unemployed start pandemic her company sell anyway extension unemployment due covid help 60 yet find another job,-1,0
596,b035afc9,I've taken up new hobbies and found ways to pass the time..  It's given me more time to practice self-care and time for my hobbies as well.,take new hobby find way pass time .. give time practice self care time hobby well,8,0.63287537
597,b035d0f1,Spend more time with children. Nice community feel. Spent more time with husband & children. Spending more time together as a family,spend time child nice community feel spend time husband child spend time together family,4,1
598,b086b7f4,"Working from home permanently. I have been able to save more due to the lack of things to do, and no commuting.",work home permanently able save due lack thing do commute,11,1
599,b08f17cf,Extra money.,extra money,-1,0
600,b0975b69,"People stay away. Now use online shopping, fewer lines, no expectation of socializing, less traffic. It was nice to have the solitude",people stay away use shop few line expectation socialize less traffic nice solitude,3,0.698083896
601,b0a94313,Better air quality. Cleaner air. I've got to know my wife and child much better. I'm eating more healthily and I exercise more,well air quality clean air get to know wife child much well eat healthily exercise,3,0.629992774
602,b0c7a26e,eating healthier.  More time with children and partner. Felt better knowing they were in the family home and safe. I started my own business and became healthier,eat healthy time child partner feel well know family home safe start business become healthy,5,0.97650639
603,b0cca0dc,Being outside  gardening. More time to be outdoors. Spent ore time with family,outside gardening time outdoors spend ore time family,-1,0
604,b10ccb7a,"closer with family. spending more time with family.  Gotten touch with friends and family through social media. My husband is working remotely and I got an remote job as a contact tracer. more time with spouse, no commute and i got a job working from home as a contact tracer",close family spending time family get touch friend family social medium husband work remotely get remote job contact tracer time spouse commute get job work home contact tracer,-1,0
605,b124efa4,More free time to pursue my hobbies. more free time to pursue my interests. more free time. more free time,free time pursue hobby free time pursue interest free time free time,8,0.763056085
606,b1303f86,"I have been able to communicate with more of my family and friends because they are home.. Eating more home cooked meals, drinking more water. I have gotten to spend more time with my children.. I have been able to spend more time with family, we are cooking meals at home now and my stress level has come down.",able communicate family friend home .. eat home cooked meal drink water get spend time child .. able spend time family cooking meal home stress level come,5,0.975093858
607,b1a7a59b,"Community spirit. Social distancing in restaurants. Cleaner air, quieter streets, better connection with nature",community spirit social distance restaurant clean air quiet street well connection nature,3,0.69009688
608,b1c7486f,Taking more exercise.   More time with family,take exercise time family,0,0.95751962
609,b25e4a19,I can't go to the library.. I have an excuse to be away from people. I have an excuse to be left alone..,can not go library .. excuse away people excuse leave alone ..,3,0.680099221
610,b2dea170,"I'm able to sit online open book exams instead of regular style exams. Less traffic on the roads, more wildlife appearing, more people enjoying the local parks.  Less drinking and spending money",able sit open book exam instead regular style exam less traffic road wildlife appear people enjoy local park less drinking spending money,3,0.688029657
611,b2f707c6,Staying at home.,stay home,7,0.464302495
612,b3254efa,Cleaner Air.,clean air,-1,0
613,b3e92d98,self isolating.,self isolate,-1,0
614,b408b0da,"people seem to be treating each other with more kindness. more time with my child. more time with my son, less social anxiety",people seem treat kindness time child time son less social anxiety,4,0.779594273
615,b40fbd68,more money .,money,-1,0
616,b44139f9,"More free time with my partner.. More free time to pursue my hobbies and interests and learn new skills.. More peace and quiet due to the slower pace of life, inspiration to get fitter and learn new skills/hobbies.. More peaceful quiet neighborhood (during the lockdowns). The ability to do things from home that I usually wouldn't be able to do from home (such as doctor's appointments etc).",free time partner .. free time pursue hobby interest learn new skill .. peace quiet due slow pace life inspiration get fitter learn new skill hobby .. peaceful quiet neighborhood lockdown ability do thing home usually would not able do home doctor appointment etc,8,0.763056085
617,b45ab6b6,spending more time at home with my family and walking exploring our local area.,spending time home family walk explore our local area,-1,0
618,b4667028,I am taking time to enjoy the little things. My relationship with my son is getting stronger.. I have become closer to my son..  I've started writing and publishing my own books,take time enjoy little thing relationship son get strong .. become close son .. start write publishing book,4,0.862017361
619,b4b96273,I like staying at home more. I like being able to order food from more places and have contactless delivery.. I like staying at home. I like that so many restaurants are offering food delivery now. I like that my house isn't constantly full of my kids' friends.. I like staying home.. I can stay home as much as I want and no one thinks it's weird. I can order food more often.,like stay home like able order food place contactless delivery .. like stay home like many restaurant offer food delivery like house not constantly full kid friend .. like stay home .. can stay home much one think weird can order food often,-1,0
620,b4d11ab7,How to deal in difficult circumstances.. Now more cautious about my general health.,how deal difficult circumstance .. cautious general health,-1,0
621,b4e79fe7,Reconnected with a friend and a couple of family members that i have not heard from in a few years. .,reconnecte friend couple family member not hear year,6,1
622,b50648b0,"Got closer to my friends and brother, got time for myself. Good grades and more time for myself",get close friend brother get time good grade time,-1,0
623,b5577889,"Taking things for granted. Taking relationships for granted, able to save",take thing grant take relationship grant able save,-1,0
624,b568e463,"closer to my spouse. cheaper to stay home, cheaper and more healthy to eat in. more home cooking, closer relationship with spouse.",close spouse cheaper stay home cheaper healthy eat home cooking close relationship spouse,1,0.624779134
625,b5cb55ee,More exercise. More exercise (daily).  More exercise,exercise exercise daily exercise,12,0.641160652
626,b61bcee3,Spending more time with loved ones.  Spending more time as a family. Time with family,spend time love one spend time family time family,1,1
627,b6433fb2,I have invested in shares and am considering a career change/early retirement.  Time to think about what really matters,invest share consider career change early retirement time think what really matter,-1,0
628,b6460218,Finding ways to be creative.,find way creative,-1,0
629,b67a02d3,Given me a chance to learn new skills. Reading and listening to more books.,give chance learn new skill read listen book,8,1
630,b7263027,"More time to myself.. More time to myself. More time to relax, read  and not be stressed by work.",time .. time time relax read not stress by work,5,0.862349931
631,b73f6dd8,"Exercise, eating better.",exercise eat well,0,1
632,b784dcbc,Spending more time with my partner.,spend time partner,1,1
633,b806f84f,Saved more money and spent more time with dog,save money spend time dog,-1,0
634,b821a3aa,"Working from home, spend more time with family. More contact with friends and family abroad. Frequent contact with family and friends via zoom",work home spend time family contact friend family abroad frequent contact family friend via zoom,6,0.54239618
635,b940710b,"Working from home is so much better. Commuting in London is expensive and very stressful... And that time can be used for other things. So I wish I could keep doing it after the crisis.. Less stress because of commuting, more money because of what I save not commuting, more time because of not commuting... Working from home is so much betger",work home much well commute london expensive stressful ... time can use thing wish could keep crisis .. less stress commute money what save not commute time not commute ... work home much betger,5,0.982227126
636,b9699b34,More home cooked meals.,home cooked meal,1,1
637,ba13f2c6,"Spending lots of time with children. More time with family, less stress through work.",spend lot time child time family less stress work,5,1
638,ba7c0749,Improved my contact with family and friends. More time spent at home - getting lots of work done in the garden .,improve contact family friend time spend home get lot work do garden,6,0.43197727
639,ba7f92f1,neighbours are a lot quieter.  saved money.,neighbour lot quieter save money,3,0.722958295
640,bac2868e,I guess I feel a bit closer to family because I'm apart from them..  Feel a bit more closer to friends and family.,guess feel bit close family apart .. feel bit close friend family,1,0.624779134
641,bace4622,Better diet & more health conscious . Thinking more healthy and also keeping myself and home more hygienic..  Trying to eat more healthily and get much needed exercise. Also more organised at home with much needed internal decoration achieved. Put a financial plan in action for the foreseeable future with retirement being forced early because of Covid-19.,well diet health conscious thinking healthy also keep home hygienic .. try eat healthily get much need exercise also organise home much need internal decoration achieve put financial plan action foreseeable future retirement force early covid 19,0,1
642,bb04064b,VIRTUAL LEARNING FOR MY CHILD,virtual learn child,8,0.674569479
643,bb43e584,"Enjoying life. Garden very tidy, family time improved. More self reliant.",enjoy life garden tidy family time improve self reliant,0,0.762831829
644,bc2553e8,exercising more.  exercise and read more.,exercise exercise read,12,1
645,bca2ca8a,New job.  Spend more time at home,new job spend time home,7,0.585713649
646,bcde083c,I've gotten closer to friends and family. Closer to old friends. I'm more connected to a friend of mine remotely.,get close friend family close old friend connect friend mine remotely,6,1
647,bcec0ea4,less busy streets and roads.  It has made me think about my future and what I really want to do and more importantly to enjoy life as it can be short.,less busy street road make think future what really do importantly enjoy life can short,-1,0
648,bd076d97,"More time with children. More family time,.  More time with family and children",time child family time time family child,2,0.934057684
649,bd9728f5,I've been able to get on with DIY jobs around the house. I've had more time to do DIY projects around the house. I am doing more DIY around the house. I have had free time at home to do DIY,able get diy job around house time do diy project around house diy around house free time home do diy,-1,0
650,be85a679,"reduced traffic, quieter, people more polite in public.   reduces socialising, shopping, travel etc",reduce traffic quiet people polite public reduce socialise shop travel etc,3,1
651,bef796a6,"more time at home with family. More sleep. Work/life balance. Working from home, saving time and money",time home family sleep work life balance work home save time money,-1,0
652,bfab4587,"More Time for myself and less crowded places.  Being able to stay at home has helped me to save money, by saving in transport and meeting with friends.",time less crowded place able stay home helped save money by save transport meeting friend,10,0.897487409
653,c04da2c5,"More exercise spending less money. more exercise, drinking less alcohol, spending less money. Sport and closer to friends. drinking less, spending less, more time with family, able to focus on myself",exercise spend less money exercise drink less alcohol spend less money sport close friend drink less spend less time family able focus,0,0.816956078
654,c06af846,Feeling of shared goals with community. Appreciation for what I have.  As an introvert it is easier without seeing everyone else's social activities all the time.,feel share goal community appreciation what introvert easy without see everyone else social activity time,-1,0
655,c12c2c79,"No social life, no meals out, no church, no shopping. No eating out, church activities, shopping or visiting.",social life meal church shop eat church activity shop visit,3,0.658861744
656,c1895752,Saved lots of money. Saved lots of money,save lot money save lot money,10,1
657,c1edd621,People washing their hands more.,people wash their hand,13,0.523945067
658,c2044501,more offline hobbies.,offline hobby,8,0.743856766
659,c2769e52,"Community pulling together, talking to family and friends regularly on zoom. community pulling together etc. more time with family. More time at home with family",community pull together talk family friend regularly zoom community pull together etc time family time home family,-1,0
660,c2a0420c,"Eating healthier, less drinking. eating less/healthier and washing hands more often. More time at home means I've been more productive. More free time for hobbies. There was a shortage of workers at my new job which led to me being hired, so my financial situation has improved and I've started saving more. Also my partner has saved so much over the pandemic that we're almost ready to buy our first house",eat healthy less drink eat less healthy washing hand often time home mean productive free time hobby shortage worker new job which lead hire financial situation improve start save also partner save much pandemic almost ready buy our first house,0,1
661,c2ef6b4d,More time for things I'd like to do,time thing would like do,2,1
662,c3367bf3,quieter surroundings. Renewed contact with old friends.  A desire for a simpler life,quiet surrounding renew contact old friend desire simple life,6,1
